title;description;category;date;videoUrl;portrait;downloadUrl
Raptorshy;W-would you mind if i eat you?;pony;07/2024;https://www.youtube.com/embed/XhV_rEazXTo;false;https://drive.google.com/drive/folders/16PHW0E8wFCMOi4hdEOlWctM8CjnX5Mpm
Chrysalis Maid;What would you like to drink?;pony;10/2025;https://www.youtube.com/embed/RtW_I_F49is;true;null
Jagdpanther;Jagdpanther tank;other;09/2021;https://www.youtube.com/embed/jW6YG2oxAXg;false;null
BMW R nineT Scrambler;BMW R nineT Scrambler motorcycle;other;12/2022;https://www.youtube.com/embed/kAbDmKDV7lI;false;null
Panzer IV Ausf. H from Garupan;Panzer IV Ausf. H tank from Garupan;other;08/2022;https://www.youtube.com/embed/UP58zRvKOwY;false;null
A-are you sure you want to go there?;Crossover with the Priestess from Goblin Slayer;pony;04/2023;https://youtube.com/embed/wUNldIk9fVg;true;https://drive.google.com/drive/folders/1A758shC-fF3FZM0cGlHzemVRokpGvNcJ
Banished to the moon... It doesn't sound that bad;Crossover with Lucy from Cyberpunk: Edgerunners;pony;02/2023;https://youtube.com/embed/6gHSFpKpUFU;true;https://drive.google.com/drive/folders/1gfjnG8pQhfNwGIvQpxhJ-1lR8SUfSjH3
Legend says she has never known defeat;Crossover with Malenia from Elden Ring;pony;05/2022;https://youtube.com/embed/5c_YII2Lwgo;true;https://drive.google.com/drive/folders/1S_okaQj9p7SH4AYTfBjAJtxcrBBk3JFB
Tomoko;Tomoko;manganime;05/2024;https://youtube.com/embed/_AHUfB5-GrE;true;https://drive.google.com/drive/folders/1RSG3vntboy728Ho76hs96CoelvASbN71
Arona, you are a little demon, stop giving me blues!;Arona from Blue Archive;manganime;01/2025;https://youtube.com/embed/Vyn2wwHi2wE;true;https://drive.google.com/drive/folders/1Tsq6UeUZOKicRmbgVl4cZElSMgWqkEJw
Angry bug;Changeling;pony;12/2021;https://youtube.com/embed/WFKyJ8OnAPw;true;https://drive.google.com/drive/folders/1f9PY37tRaCfU9J_mh_Td3VLFWfbFC47k
Echo the Bat Pony;Be careful when buying fruit on nightmare night...;pony;11/2024;https://youtube.com/embed/6qIs_lm_3Ks;true;https://drive.google.com/drive/folders/1Vck10wKfR4tS316NhV5E-KPwVgSE8RR1
Troopers! We are green, and very, very mean!;Crossover with the ODSTs from Halo;pony;06/2025;https://youtube.com/embed/cUn_SaJwQJQ;true;null
I always wanted one of these;Golly;pony;12/2022;https://www.youtube.com/embed/GPCyZFcgVnU;false;null
The cable... I'm going to cut it;Crossover with the Arbiter from Halo;pony;03/2025;https://www.youtube.com/embed/eh7oIfSh0UE;false;null